{"$schema":"https://json-schema.org/draft/2020-12/schema","title":"Byte operation","type":"object","additionalProperties":false,"required":["schema_version","id","packet_id","worker_id","lease_id","changes"],"properties":{"schema_version":{"const":1},"id":{"type":"string"},"packet_id":{"type":"string"},"worker_id":{"type":"string"},"lease_id":{"type":"string"},"changes":{"type":"array","minItems":1,"items":{"type":"object","additionalProperties":false,"required":["path","before_sha256","splices"],"properties":{"path":{"type":"string"},"before_sha256":{"type":["string","null"]},"splices":{"type":"array","minItems":1,"items":{"type":"object","additionalProperties":false,"required":["offset","delete_bytes","insert_base64"],"properties":{"offset":{"type":"integer","minimum":0},"delete_bytes":{"type":"integer","minimum":0},"insert_base64":{"type":"string"}}}}}}}}}
